{
  "colour": {
    "normal": "Mid to dark green from about V3; there is no single corn green. Chromaticity (each channel over the sum) removes most of the brightness difference between sunlit and shaded leaves; what remains varies with stage, stress, white balance and camera.",
    "variants": [
      {
        "id": "emergence-yellow-green",
        "name": "Yellow-green seedlings",
        "appearance": "Pale yellow-green until the nodal roots take over at about V3.",
        "stages": [
          "VE",
          "V1",
          "V2"
        ],
        "evidence": {
          "sources": [
            "purdue-ve-v3-2021"
          ],
          "strength": "moderate"
        }
      },
      {
        "id": "purpling",
        "name": "Purple seedlings (cold, wet soil or phosphorus)",
        "appearance": "Anthocyanin on the oldest leaves, usually gone by V6; persistent purple margins on new leaves point to phosphorus. Worked example ExGR about -0.14, below the vegetation cut: false skips in the row.",
        "stages": [
          "V2",
          "V3",
          "V4",
          "V5"
        ],
        "evidence": {
          "sources": [
            "bayer-purple",
            "msu-purple-corn"
          ],
          "strength": "weak",
          "notes": "The ExGR value is worked from an assumed colour ratio; it needs measuring on kept originals."
        }
      },
      {
        "id": "n-deficiency",
        "name": "Nitrogen deficiency",
        "appearance": "V-shaped yellowing from the tip down the midrib of the oldest leaves; from above after V8 a paler canopy. Worked example ExGR about +0.15: usually stays in the green mask.",
        "evidence": {
          "sources": [
            "isu-ipm42"
          ],
          "strength": "moderate"
        }
      },
      {
        "id": "drought-rolling",
        "name": "Drought leaf rolling",
        "appearance": "Leaves roll to thin lines at midday: less cover, more sunlit soil; thin leaves lost at coarse pixel sizes.",
        "evidence": {
          "sources": [
            "zhang-2019-drought"
          ],
          "strength": "snippet"
        }
      },
      {
        "id": "tassels",
        "name": "Tassels",
        "appearance": "Pale tassels on top of the canopy at VT to R1; below the vegetation cut, inside the cover mask.",
        "stages": [
          "VT",
          "R1"
        ],
        "evidence": {
          "sources": [
            "tassel-detection-2021"
          ],
          "strength": "snippet"
        }
      },
      {
        "id": "senescence",
        "name": "Senescence",
        "appearance": "Yellow then brown from the lower leaves up at R5 to R6; the green mask empties.",
        "stages": [
          "R5",
          "R6"
        ],
        "evidence": {
          "sources": [
            "makanza-2018"
          ],
          "strength": "strong"
        }
      }
    ]
  },
  "indices": [
    {
      "id": "exg-cive-otsu",
      "name": "ExG + 0.5 × CIVE on chromaticity, Otsu per window (the app's photo and map pattern mask)",
      "formula": "(2g - r - b) + 0.5 × -(0.441 r - 0.811 g + 0.385 b), r g b chromaticity",
      "thresholds": "Otsu per window with a whole-photo fallback. On every corn and orchard photo tested the split sits at 0.20 to 0.34; on a red-soil no-till photo it fell to -0.20, between soil and straw.",
      "performance": "ExG and CIVE are the least stable indices over a day in wheat (coefficient of variation 56% and 58% against 2% for ExGR; Qseg 0.617 and 0.65 against 0.776).",
      "evidence": {
        "sources": [
          "woebbecke-1995",
          "sadeghi-tehran-2017",
          "swardus-corn-photos-2026-10-23"
        ],
        "strength": "strong",
        "notes": "Otsu always returns a split; when one class is missing (closed canopy, all soil) or the two classes are soil and straw, the split is not a plant/ground split."
      }
    },
    {
      "id": "exgr",
      "name": "ExGR (ExG - ExR) at zero (the app's field-map vegetation mask)",
      "formula": "(2g - r - b) - (1.4 r - g), chromaticity; equivalently 4g - 1.4r - 1",
      "thresholds": "Fixed at 0 (Meyer and Neto 2008). Measured on our imagery: soil about -0.24, straw about -0.14, neutral grey -0.133; the cover mask cuts at -0.08.",
      "performance": "Quality factor 0.88 ± 0.12 against 0.53 ± 0.39 for ExG with Otsu in greenhouse tests; both about 0.88 on field soybean; most stable over a day in wheat.",
      "evidence": {
        "sources": [
          "meyer-neto-2008",
          "sadeghi-tehran-2017",
          "swardus-corn-photos-2026-10-23"
        ],
        "strength": "moderate",
        "disagreement": "A UAV maize seedling study (snippet) ranked ExG with Otsu best; platforms, stages and scoring differ."
      }
    }
  ],
  "illumination": [
    {
      "id": "hard-shadow",
      "name": "Hard shadows",
      "effect": "Shadowed soil and leaves are misclassified; cover underestimated by up to 0.2 at peak growth; ExG is the worst affected. Shadow length = height / tan(sun elevation): a 30 cm V5 plant casts 17 cm at 60° and 52 cm at 30°; a 60 cm V8 plant at 30° spans a 76 cm alley.",
      "guidance": "Fly in diffuse light (overcast or early morning) or within about two hours of solar noon; treat cells whose deep-shadow share exceeds the limit as not assessed.",
      "evidence": {
        "sources": [
          "shadow-removal-2018",
          "song-2015",
          "makanza-2018"
        ],
        "strength": "moderate"
      }
    },
    {
      "id": "glint-hotspot",
      "name": "Glint, hotspot, wet leaves",
      "effect": "Near-saturated colourless highlights drop out of the mask and leave holes in leaves; the hotspot sits opposite the sun.",
      "evidence": {
        "sources": [
          "sadeghi-tehran-2017"
        ],
        "strength": "strong"
      }
    },
    {
      "id": "white-balance-drift",
      "name": "White-balance drift between frames",
      "effect": "A shift of 0.02 in green chromaticity moves ExGR by 0.08 (our arithmetic): enough to push soil or straw over the cover cut. Orthomosaic colour balancing can do the same across seams.",
      "guidance": "Compare each frame's soil index with the field median; lock white balance when flying.",
      "evidence": {
        "sources": [
          "swardus-corn-photos-2026-10-23"
        ],
        "strength": "estimate"
      }
    }
  ],
  "backgrounds": [
    {
      "id": "light-soil",
      "name": "Light, dry soil",
      "appearance": "Pale brown, slightly negative excess green.",
      "effectOnIndex": "Clean separation; Otsu at about 0.27 on the close-up corn photo.",
      "evidence": {
        "sources": [
          "swardus-corn-photos-2026-10-23"
        ],
        "strength": "weak"
      }
    },
    {
      "id": "red-soil",
      "name": "Red, iron-rich soil (latossolo, terra rossa)",
      "appearance": "Strongly red; very negative excess green (about -0.4).",
      "effectOnIndex": "With bright straw present Otsu splits soil from straw (threshold about -0.20) and the 'vegetation' mask covers 79% of the photo.",
      "evidence": {
        "sources": [
          "swardus-corn-photos-2026-10-23"
        ],
        "strength": "weak",
        "notes": "One photo; the cause is general (Otsu splits the two largest modes)."
      }
    },
    {
      "id": "wet-dark-soil",
      "name": "Wet or dark soil",
      "appearance": "Darker but its colour ratio barely changes; noisier; very wet soil can glint.",
      "effectOnIndex": "Little change in chromaticity indices; more noise in dark pixels.",
      "evidence": {
        "sources": [
          "asprs-1986"
        ],
        "strength": "snippet"
      }
    },
    {
      "id": "crop-residue",
      "name": "Straw and stover residue",
      "appearance": "Bright, near-neutral, elongated; in no-till it forms stripes at the crop's own pitch, often offset from the new rows.",
      "effectOnIndex": "ExG with Otsu gives false positives on bright residue; ExGR at zero holds (straw about -0.14). Brightness profiles see the straw stripes as rows.",
      "evidence": {
        "sources": [
          "meyer-neto-2008",
          "camargo-neto-2004",
          "swardus-corn-photos-2026-10-23"
        ],
        "strength": "moderate"
      }
    },
    {
      "id": "algae-moss",
      "name": "Algae or moss on wet soil",
      "appearance": "Smooth, spread-out green without plant shape.",
      "effectOnIndex": "Genuine green false positives.",
      "evidence": {
        "sources": [],
        "strength": "none",
        "notes": "Not found; mechanism only."
      }
    }
  ],
  "orthomosaicArtefacts": [
    {
      "id": "stitching-repetitive",
      "name": "Stitching failure over repetitive rows",
      "effect": "Misregistration, doubled or kinked rows, seams; rows break at seam lines.",
      "evidence": {
        "sources": [
          "aktar-2020"
        ],
        "strength": "moderate"
      }
    },
    {
      "id": "ortho-blur",
      "name": "Resampling and blending blur",
      "effect": "Maize stand counting R² 0.616 on mosaics against 0.906 on the original frames; holes and 'melted' seedlings in a WebODM mosaic. Measure plants in the original frames.",
      "evidence": {
        "sources": [
          "masc-2025"
        ],
        "strength": "moderate"
      }
    },
    {
      "id": "ghosting",
      "name": "Wind or downdraft ghosting",
      "effect": "Blurred or doubled plants in the mosaic.",
      "evidence": {
        "sources": [
          "aktar-2020"
        ],
        "strength": "weak"
      }
    },
    {
      "id": "relief-displacement",
      "name": "Relief displacement of tall corn",
      "effect": "d = D × h / (H - h): at 60 m above ground and 20 m from the frame centre a 2.5 m canopy leans 0.87 m, more than a 76 cm row; at V5 the lean is about 15 cm at 40 m.",
      "evidence": {
        "sources": [